{
  "schema": "delysis.vertical_fixture_manifest.v0",
  "vertical_id": "quit_relaunch_fake_owners",
  "class": "model_free",
  "contract_revision": "cbab33555ab9355a6ac453d659c55ec9e0666821",
  "cases": [
    {
      "case_id": "gateway_owner.quit_relaunch",
      "source": {
        "repository_id": "delysis/free-token-energy",
        "commit": "797500060047ccd10f9810fb4d5c8f374e00eb08",
        "production_tree": {
          "id": "fte.quit_relaunch.production.source.2db2d45",
          "digest": {
            "algorithm": "sha256",
            "hex": "d8578c94683fc597c5ce8bb4dec1898b379c40f450bc22a957c81513b54df0f3"
          },
          "length": 950
        }
      },
      "inputs": [
        {
          "identity": {
            "id": "fte.quit_relaunch.input.v1",
            "digest": {
              "algorithm": "sha256",
              "hex": "2692b9ddb4e2645e3d13b644e859463f7f46d770eb3d4ca1e4ea51b999e54014"
            },
            "length": 1105
          },
          "availability": "checked_in",
          "relative_path": "tests/fixtures/w1/v0/fte-quit-relaunch-input-v1.json"
        }
      ],
      "state_identities": [
        {
          "state_id": "fte.runtime.profile",
          "schema_id": "fte.database.master_profile.v1",
          "baseline": {
            "identity": {
              "id": "fte.runtime.profile.marker",
              "digest": {
                "algorithm": "sha256",
                "hex": "3c685d4fd0e247dfdcd65f95f50575b2d96930dda96ce2d79932eedcd03078e4"
              },
              "length": 40
            },
            "availability": "generated_fixture",
            "relative_path": null
          }
        }
      ],
      "prerequisites": [],
      "replay": [
        {
          "program": { "kind": "cargo" },
          "argv": [
            "test",
            "--locked",
            "-p",
            "free-token-energy",
            "--features",
            "unstable-w1-vertical-tests",
            "--lib",
            "gateway_runtime::w1_quit_relaunch_tests::w1_product_owner_quit_relaunch_is_quiescent_and_fresh",
            "--",
            "--exact"
          ],
          "required_environment": [],
          "network": "denied"
        }
      ],
      "expected_projection": {
        "id": "fte.quit_relaunch.expected_projection",
        "digest": {
          "algorithm": "sha256",
          "hex": "8106e7832093fb94f548dfe47de974bc5b897c7e7c6b0950f14f9c1e88226b76"
        },
        "length": 5714
      }
    }
  ],
  "omitted_claims": [
    "live Tauri window event dispatch",
    "real model inference during the lifecycle probe",
    "live hosted-provider behavior",
    "operating-system process enumeration outside product-owned join receipts"
  ],
  "negative_evidence": []
}
