{
  "schema": "delysis.vertical_fixture_manifest.v0",
  "vertical_id": "quit_relaunch_fake_owners",
  "class": "model_free",
  "contract_revision": "cbab33555ab9355a6ac453d659c55ec9e0666821",
  "cases": [
    {
      "case_id": "loom.full-application-close-and-fresh-runtime",
      "source": {
        "repository_id": "delysis/loom-native",
        "commit": "5b0d81ebbf0f7561f81829a34ef84b50412c17b1",
        "production_tree": {
          "id": "loom.row8.production.source_objects.5b0d81e",
          "digest": {
            "algorithm": "sha256",
            "hex": "f35be5a9fe9e43dae2980814f25c4520bff5cb88b943ec682f12e813d7c36ea3"
          },
          "length": 651
        }
      },
      "inputs": [
        {
          "identity": {
            "id": "loom.quit-relaunch.input",
            "digest": {
              "algorithm": "sha256",
              "hex": "bea75b3e3ea5774b8ae3c490681a212dc2879bf5508598f75b9025d834eba512"
            },
            "length": 246
          },
          "availability": "checked_in",
          "relative_path": "fixtures/w1/loom-quit-relaunch-v1.json"
        }
      ],
      "state_identities": [],
      "prerequisites": [],
      "replay": [
        {
          "program": { "kind": "cargo" },
          "argv": [
            "test",
            "-p",
            "tauri-plugin-loom",
            "--features",
            "unstable-w1-vertical-tests",
            "w1_vertical_fixture::full_application_close_joins_fake_generation_owner_and_fresh_runtime_admits_work",
            "--",
            "--exact"
          ],
          "required_environment": [],
          "network": "denied"
        }
      ],
      "expected_projection": {
        "id": "loom.quit-relaunch.projection",
        "digest": {
          "algorithm": "sha256",
          "hex": "84a3b6f5b0258955cd3a4696a7a693b660b9036cb619206b4c9555b2f61fd616"
        },
        "length": 2627
      }
    }
  ],
  "omitted_claims": [
    "native GUI process relaunch",
    "real model inference"
  ],
  "negative_evidence": []
}
