{
  "schema": "delysis.vertical_fixture_manifest.v0",
  "vertical_id": "quit_relaunch_fake_owners",
  "class": "model_free",
  "contract_revision": "cbab33555ab9355a6ac453d659c55ec9e0666821",
  "cases": [
    {
      "case_id": "native-quit-relaunch-fake-owners",
      "source": {
        "repository_id": "delysis/llama-native-kit",
        "commit": "897dd86a961707c66021d1eaabcfd19314cb05f7",
        "production_tree": {
          "id": "native-quit-relaunch-source-tree",
          "digest": {
            "algorithm": "sha256",
            "hex": "44255dadecd488951323b1be90a24993d0679436cedb783fffd166e1d6eb5671"
          },
          "length": 197
        }
      },
      "inputs": [
        {
          "identity": {
            "id": "native-quit-relaunch-input",
            "digest": {
              "algorithm": "sha256",
              "hex": "434d1e0ee7f89be9da0c05df6822d448cb2156893f9578e25050ce8a5f6c70cd"
            },
            "length": 330
          },
          "availability": "checked_in",
          "relative_path": "fixtures/w1/native-quit-relaunch-input-v0.json"
        },
        {
          "identity": {
            "id": "native-quit-relaunch-source-tree",
            "digest": {
              "algorithm": "sha256",
              "hex": "44255dadecd488951323b1be90a24993d0679436cedb783fffd166e1d6eb5671"
            },
            "length": 197
          },
          "availability": "checked_in",
          "relative_path": "fixtures/w1/native-quit-relaunch-source-tree-v0.txt"
        }
      ],
      "state_identities": [],
      "prerequisites": [],
      "replay": [
        {
          "program": { "kind": "cargo" },
          "argv": [
            "test",
            "--locked",
            "-p",
            "llama-native-engine",
            "--features",
            "unstable-w1-vertical-tests",
            "w1_vertical_fixture::w1_quit_relaunch_fake_owners_baseline",
            "--",
            "--exact"
          ],
          "required_environment": [],
          "network": "denied"
        }
      ],
      "expected_projection": {
        "id": "native-quit-relaunch-projection",
        "digest": {
          "algorithm": "sha256",
          "hex": "a49505f9ef76502e661e88ec10aa9951c9d1a08da98ca871ee9965838a900618"
        },
        "length": 3163
      }
    }
  ],
  "omitted_claims": [
    "real GGUF loading or inference",
    "operating-system process relaunch",
    "downstream product user-interface quit behavior",
    "downstream product durable-store format"
  ],
  "negative_evidence": []
}
